{"schemaVersion":1,"registryVersion":1,"status":"planningSeed","generatedAt":null,"sourceCommit":null,"commands":[{"id":"workspace.open","since":1,"labelKey":"command.workspace.open.label","descriptionKey":"command.workspace.open.description","category":"workspace","scope":["app","studio","live","keyboard","midi","external"],"interaction":"selection","realtimeClass":"viewLocal","parameters":{"workspace":{"type":"enum","required":true,"enumValues":["projectHub","studio","live","safe"]}},"availability":true,"undoable":false,"persistenceScope":"appLocal","deprecated":false},{"id":"view.panel.open","since":1,"labelKey":"command.view.panel.open.label","descriptionKey":"command.view.panel.open.description","category":"view","scope":["app","studio","live","keyboard","midi"],"interaction":"selection","realtimeClass":"viewLocal","parameters":{"panel":{"type":"string","required":true,"maxLength":128}},"availability":true,"undoable":false,"persistenceScope":"appLocal","deprecated":false},{"id":"view.panel.toggle","since":1,"labelKey":"command.view.panel.toggle.label","descriptionKey":"command.view.panel.toggle.description","category":"view","scope":["app","studio","live","keyboard","midi"],"interaction":"toggle","realtimeClass":"viewLocal","parameters":{"panel":{"type":"string","required":true,"maxLength":128}},"availability":true,"undoable":false,"persistenceScope":"appLocal","deprecated":false},{"id":"view.skin.select","since":1,"labelKey":"command.view.skin.select.label","descriptionKey":"command.view.skin.select.description","category":"view","scope":["app","studio","live","keyboard"],"interaction":"selection","realtimeClass":"viewLocal","parameters":{"skinId":{"type":"string","required":true,"maxLength":128}},"availability":true,"undoable":false,"persistenceScope":"appLocal","deprecated":false},{"id":"view.commandExplorer.open","since":1,"labelKey":"command.view.commandExplorer.open.label","descriptionKey":"command.view.commandExplorer.open.description","category":"view","scope":["app","studio","live","keyboard","midi"],"interaction":"trigger","realtimeClass":"viewLocal","parameters":{},"availability":true,"undoable":false,"persistenceScope":"none","deprecated":false},{"id":"project.open","since":1,"labelKey":"command.project.open.label","descriptionKey":"command.project.open.description","category":"project","scope":["app","studio","keyboard","external"],"interaction":"transaction","realtimeClass":"blockingUtility","parameters":{"path":{"type":"string","required":true,"maxLength":4096}},"availability":true,"undoable":false,"persistenceScope":"appLocal","deprecated":false},{"id":"project.save","since":1,"labelKey":"command.project.save.label","descriptionKey":"command.project.save.description","category":"project","scope":["app","studio","keyboard","midi","external"],"interaction":"trigger","realtimeClass":"studioMutation","parameters":{},"availability":"project.lifecycle == 'open'","undoable":false,"persistenceScope":"projectAuthored","deprecated":false,"feedback":["project.saveState","project.lastVerifiedSave"]},{"id":"project.validate","since":1,"labelKey":"command.project.validate.label","descriptionKey":"command.project.validate.description","category":"project","scope":["app","studio","live","keyboard","external"],"interaction":"trigger","realtimeClass":"studioMutation","parameters":{},"availability":"project.lifecycle == 'open'","undoable":false,"persistenceScope":"none","deprecated":false,"feedback":["project.validation.summary"]},{"id":"show.start","since":1,"labelKey":"command.show.start.label","descriptionKey":"command.show.start.description","category":"show","scope":["live","keyboard","midi","controller","external"],"interaction":"trigger","realtimeClass":"priorityLive","parameters":{},"availability":"project.activePackage.available && runner.state != 'running'","undoable":false,"persistenceScope":"liveTransient","deprecated":false,"feedback":["runner.state"]},{"id":"show.stop","since":1,"labelKey":"command.show.stop.label","descriptionKey":"command.show.stop.description","category":"show","scope":["live","keyboard","midi","controller","external"],"interaction":"trigger","realtimeClass":"priorityLive","parameters":{},"availability":true,"undoable":false,"persistenceScope":"liveTransient","deprecated":false,"feedback":["runner.state"]},{"id":"show.toggleRunning","since":1,"labelKey":"command.show.toggleRunning.label","descriptionKey":"command.show.toggleRunning.description","category":"show","scope":["live","keyboard","midi","controller"],"interaction":"toggle","realtimeClass":"priorityLive","parameters":{},"availability":true,"undoable":false,"persistenceScope":"liveTransient","deprecated":false,"feedback":["runner.state"]},{"id":"output.blackout.set","since":1,"labelKey":"command.output.blackout.set.label","descriptionKey":"command.output.blackout.set.description","category":"safety","scope":["live","keyboard","midi","controller","external"],"interaction":"absolute","realtimeClass":"emergency","parameters":{"active":{"type":"boolean","required":true}},"availability":true,"safetyGate":"blackoutAuthority","undoable":false,"persistenceScope":"liveTransient","deprecated":false,"feedback":["output.blackout"]},{"id":"output.blackout.toggle","since":1,"labelKey":"command.output.blackout.toggle.label","descriptionKey":"command.output.blackout.toggle.description","category":"safety","scope":["live","keyboard","midi","controller"],"interaction":"toggle","realtimeClass":"emergency","parameters":{},"availability":true,"safetyGate":"blackoutAuthority","undoable":false,"persistenceScope":"liveTransient","deprecated":false,"feedback":["output.blackout"]},{"id":"output.workLight.set","since":1,"labelKey":"command.output.workLight.set.label","descriptionKey":"command.output.workLight.set.description","category":"safety","scope":["live","keyboard","midi","controller","external"],"interaction":"absolute","realtimeClass":"priorityLive","parameters":{"active":{"type":"boolean","required":true}},"availability":"runner.state != 'fault'","undoable":false,"persistenceScope":"liveTransient","deprecated":false,"feedback":["output.workLight"]},{"id":"output.workLight.toggle","since":1,"labelKey":"command.output.workLight.toggle.label","descriptionKey":"command.output.workLight.toggle.description","category":"safety","scope":["live","keyboard","midi","controller"],"interaction":"toggle","realtimeClass":"priorityLive","parameters":{},"availability":"runner.state != 'fault'","undoable":false,"persistenceScope":"liveTransient","deprecated":false,"feedback":["output.workLight"]},{"id":"override.releaseAll","since":1,"labelKey":"command.override.releaseAll.label","descriptionKey":"command.override.releaseAll.description","category":"override","scope":["live","keyboard","midi","controller","external"],"interaction":"trigger","realtimeClass":"priorityLive","parameters":{},"availability":"runner.state == 'running'","undoable":false,"persistenceScope":"liveTransient","deprecated":false,"feedback":["override.activePropertyCount"]},{"id":"transport.manualBpm.set","since":1,"labelKey":"command.transport.manualBpm.set.label","descriptionKey":"command.transport.manualBpm.set.description","category":"transport","scope":["live","studio","keyboard","midi","controller","external"],"interaction":"absolute","realtimeClass":"runnerCommand","parameters":{"bpm":{"type":"number","required":true,"minimum":30,"maximum":300,"unit":"bpm"}},"availability":true,"undoable":false,"persistenceScope":"liveTransient","deprecated":false,"feedback":["transport.bpm","transport.syncState"]},{"id":"transport.tap","since":1,"labelKey":"command.transport.tap.label","descriptionKey":"command.transport.tap.description","category":"transport","scope":["live","studio","keyboard","midi","controller","external"],"interaction":"trigger","realtimeClass":"runnerCommand","parameters":{},"availability":true,"undoable":false,"persistenceScope":"liveTransient","deprecated":false,"feedback":["transport.bpm","transport.syncState"]},{"id":"connection.os2l.reconnect","since":1,"labelKey":"command.connection.os2l.reconnect.label","descriptionKey":"command.connection.os2l.reconnect.description","category":"connection","scope":["app","studio","live","keyboard","midi","external"],"interaction":"trigger","realtimeClass":"priorityLive","parameters":{},"availability":"connection.os2l.configured","undoable":false,"persistenceScope":"none","deprecated":false,"feedback":["connection.os2l.status","connection.os2l.lastError"]},{"id":"autoloop.launch","since":1,"labelKey":"command.autoloop.launch.label","descriptionKey":"command.autoloop.launch.description","category":"autoloop","scope":["live","keyboard","midi","controller","external"],"interaction":"trigger","realtimeClass":"runnerCommand","parameters":{"bank":{"type":"integer","required":true,"minimum":0,"maximum":63},"slot":{"type":"integer","required":true,"minimum":0,"maximum":31}},"availability":"runner.state == 'running' && autoloop.exists(bank,slot)","undoable":false,"persistenceScope":"liveTransient","deprecated":false,"feedback":["autoloop.active.id","autoloop.active.bank","autoloop.active.slot","autoloop.active.progress"]},{"id":"autoloop.clear","since":1,"labelKey":"command.autoloop.clear.label","descriptionKey":"command.autoloop.clear.description","category":"autoloop","scope":["live","keyboard","midi","controller","external"],"interaction":"trigger","realtimeClass":"runnerCommand","parameters":{},"availability":"runner.state == 'running'","undoable":false,"persistenceScope":"liveTransient","deprecated":false,"feedback":["autoloop.active.id"]},{"id":"autoloop.next","since":1,"labelKey":"command.autoloop.next.label","descriptionKey":"command.autoloop.next.description","category":"autoloop","scope":["live","keyboard","midi","controller"],"interaction":"trigger","realtimeClass":"runnerCommand","parameters":{},"availability":"runner.state == 'running'","undoable":false,"persistenceScope":"liveTransient","deprecated":false,"feedback":["autol